{
  "$schema": "./schema.media.json",
  "schema_version": 1,
  "catalog_version": 1,
  "updated_at": "2026-10-13T00:00:00Z",
  "dialects": {
    "openai-images": {
      "kind": "image",
      "workflows": [
        "create"
      ],
      "params": {
        "size": {
          "kind": "enum",
          "values": [
            "auto",
            "1024x1024",
            "1536x1024",
            "1024x1536"
          ],
          "default": "auto"
        }
      }
    },
    "xai-images": {
      "kind": "image",
      "workflows": [
        "create",
        "edit",
        "reference"
      ],
      "params": {
        "aspect_ratios": {
          "values": [
            "auto",
            "1:1",
            "16:9",
            "9:16",
            "4:3",
            "3:4",
            "3:2",
            "2:3",
            "2:1",
            "1:2",
            "21:9"
          ],
          "default": "auto"
        },
        "resolutions": {
          "values": [
            "1k",
            "2k"
          ],
          "default": "1k"
        },
        "max_input_images": 5
      }
    },
    "openrouter-images": {
      "kind": "image",
      "workflows": [
        "create"
      ],
      "params": {}
    },
    "gemini-image": {
      "kind": "image",
      "workflows": [
        "create",
        "edit",
        "reference"
      ],
      "params": {
        "aspect_ratios": {
          "values": [
            "1:1",
            "2:3",
            "3:2",
            "3:4",
            "4:3",
            "4:5",
            "5:4",
            "9:16",
            "16:9",
            "21:9"
          ],
          "default": "1:1"
        },
        "resolutions": {
          "values": [
            "1K",
            "2K"
          ],
          "default": "1K"
        },
        "max_input_images": 14
      }
    },
    "minimax-image": {
      "kind": "image",
      "workflows": [
        "create"
      ],
      "params": {
        "aspect_ratios": {
          "values": [
            "1:1",
            "16:9",
            "4:3",
            "3:2",
            "2:3",
            "3:4",
            "9:16",
            "21:9"
          ],
          "default": "1:1"
        }
      }
    },
    "dashscope-image": {
      "kind": "image",
      "workflows": [
        "create"
      ],
      "params": {
        "size": {
          "kind": "enum",
          "values": [
            "1024x1024",
            "1280x720",
            "720x1280"
          ],
          "default": "1024x1024"
        }
      }
    },
    "hf-images": {
      "kind": "image",
      "workflows": [
        "create"
      ],
      "params": {
        "seed": true
      }
    },
    "nvidia-genai": {
      "kind": "image",
      "workflows": [
        "create"
      ],
      "params": {
        "seed": true
      }
    },
    "mistral-agent-image": {
      "kind": "image",
      "workflows": [
        "create"
      ],
      "params": {}
    },
    "a1111": {
      "kind": "image",
      "workflows": [
        "create",
        "transform",
        "inpaint"
      ],
      "params": {
        "size": {
          "kind": "range",
          "min": 256,
          "max": 2048,
          "multiple": 8,
          "default_width": 1024,
          "default_height": 1024
        },
        "n": {
          "max": 4
        },
        "seed": true,
        "negative_prompt": true,
        "steps": {
          "min": 1,
          "max": 150,
          "default": 25
        },
        "cfg": {
          "min": 1,
          "max": 30,
          "default": 7,
          "step": 0.5
        },
        "strength": {
          "min": 0,
          "max": 1,
          "default": 0.75,
          "step": 0.05
        },
        "sampler": true
      }
    },
    "openai-videos": {
      "kind": "video",
      "workflows": [
        "create",
        "image-to-video"
      ],
      "params": {
        "durations": {
          "values": [
            4,
            8,
            12
          ],
          "default": 4
        },
        "sizes": {
          "values": [
            "1280x720",
            "720x1280"
          ],
          "default": "1280x720"
        }
      }
    },
    "openrouter-videos": {
      "kind": "video",
      "workflows": [
        "create"
      ],
      "params": {}
    },
    "xai-videos": {
      "kind": "video",
      "workflows": [
        "create",
        "image-to-video"
      ],
      "params": {
        "durations": {
          "min": 1,
          "max": 15,
          "default": 8
        },
        "resolutions": {
          "values": [
            "480p",
            "720p",
            "1080p"
          ],
          "default": "720p"
        },
        "aspect_ratios": {
          "values": [
            "16:9",
            "9:16",
            "1:1",
            "4:3",
            "3:4",
            "3:2",
            "2:3",
            "21:9"
          ],
          "default": "16:9"
        },
        "audio": true,
        "last_frame": true
      }
    },
    "gemini-veo": {
      "kind": "video",
      "workflows": [
        "create",
        "image-to-video"
      ],
      "params": {
        "durations": {
          "values": [
            4,
            6,
            8
          ],
          "default": 8
        },
        "resolutions": {
          "values": [
            "720p",
            "1080p"
          ],
          "default": "720p"
        },
        "aspect_ratios": {
          "values": [
            "16:9",
            "9:16"
          ],
          "default": "16:9"
        },
        "seed": true,
        "last_frame": true
      }
    },
    "minimax-video": {
      "kind": "video",
      "workflows": [
        "create"
      ],
      "params": {
        "durations": {
          "values": [
            6,
            10
          ],
          "default": 6
        },
        "resolutions": {
          "values": [
            "768P",
            "1080P"
          ],
          "default": "768P"
        }
      }
    },
    "minimax-video-v2": {
      "kind": "video",
      "workflows": [
        "create",
        "image-to-video"
      ],
      "params": {
        "durations": {
          "min": 4,
          "max": 15,
          "default": 6
        },
        "resolutions": {
          "values": [
            "768P"
          ],
          "default": "768P"
        },
        "aspect_ratios": {
          "values": [
            "16:9",
            "9:16",
            "1:1",
            "4:3",
            "3:4",
            "21:9"
          ],
          "default": "16:9"
        }
      }
    },
    "dashscope-video": {
      "kind": "video",
      "workflows": [
        "create"
      ],
      "params": {
        "durations": {
          "min": 2,
          "max": 15,
          "default": 5
        },
        "resolutions": {
          "values": [
            "720P",
            "1080P"
          ],
          "default": "720P"
        }
      }
    },
    "aimlapi-videos": {
      "kind": "video",
      "workflows": [
        "create"
      ],
      "params": {}
    },
    "hf-videos": {
      "kind": "video",
      "workflows": [
        "create"
      ],
      "params": {}
    }
  },
  "providers": {
    "openai": {
      "image": {
        "api": "openai-images",
        "models": [
          {
            "id": "gpt-image-2.5-flare",
            "name": "GPT Image 2.5 Flare",
            "default": true,
            "workflows": [
              "create",
              "edit",
              "reference",
              "inpaint"
            ],
            "params": {
              "size": {
                "kind": "enum",
                "values": [
                  "auto",
                  "1024x1024",
                  "1536x1024",
                  "1024x1536",
                  "2048x2048",
                  "2048x1152",
                  "1152x2048"
                ],
                "default": "auto"
              },
              "quality": {
                "values": [
                  "auto",
                  "low",
                  "medium",
                  "high",
                  "xhigh",
                  "max"
                ],
                "default": "auto"
              },
              "background": {
                "values": [
                  "auto",
                  "opaque",
                  "transparent"
                ],
                "default": "auto"
              },
              "output_format": {
                "values": [
                  "png",
                  "jpeg",
                  "webp"
                ],
                "default": "png"
              },
              "n": {
                "max": 4
              },
              "max_input_images": 16
            }
          },
          {
            "id": "gpt-image-2.5-sunburst",
            "name": "GPT Image 2.5 Sunburst",
            "workflows": [
              "create",
              "edit",
              "reference",
              "inpaint"
            ],
            "params": {
              "size": {
                "kind": "enum",
                "values": [
                  "auto",
                  "1024x1024",
                  "1536x1024",
                  "1024x1536",
                  "2048x2048",
                  "2048x1152",
                  "1152x2048"
                ],
                "default": "auto"
              },
              "quality": {
                "values": [
                  "auto",
                  "low",
                  "medium",
                  "high",
                  "xhigh",
                  "max"
                ],
                "default": "auto"
              },
              "background": {
                "values": [
                  "auto",
                  "opaque",
                  "transparent"
                ],
                "default": "auto"
              },
              "output_format": {
                "values": [